{
  "project": "Global LLM Atlas",
  "dimension": "android",
  "version": "0.3.0",
  "released": "2026-10-20",
  "methodology": "Only Android availability backed by an official product/store/download source is listed. A verification date records source review, not APK installation, a security audit, successful login or availability in every country. Absence means not independently verified, never unsupported. Related non-conversational companion apps are excluded from conversational access counts.",
  "entries": [
    {
      "id": "at-comfyai",
      "status": "native",
      "distribution": "google-play",
      "url": "https://play.google.com/store/apps/details?id=de.comfyai",
      "verified": "2026-09-15"
    },
    {
      "id": "br-maritaca",
      "status": "native",
      "distribution": "google-play",
      "url": "https://play.google.com/store/apps/details?id=com.maritaca.app",
      "verified": "2026-09-15"
    },
    {
      "id": "bg-bggpt",
      "status": "native",
      "distribution": "google-play",
      "url": "https://play.google.com/store/apps/details?id=com.insait.bggpt",
      "verified": "2026-09-15"
    },
    {
      "id": "cn-deepseek",
      "status": "native",
      "distribution": "google-play",
      "url": "https://play.google.com/store/apps/details?id=com.deepseek.chat",
      "verified": "2026-09-15"
    },
    {
      "id": "cn-ernie",
      "status": "regional",
      "distribution": "official-regional",
      "url": "https://ernie.baidu.com/",
      "verified": "2026-09-15"
    },
    {
      "id": "cn-kimi-ai",
      "status": "native",
      "distribution": "official-download",
      "url": "https://www.kimi.com/en/products/download",
      "verified": "2026-09-15"
    },
    {
      "id": "cn-manus",
      "status": "native",
      "distribution": "google-play",
      "url": "https://play.google.com/store/apps/details?id=tech.butterfly.app",
      "verified": "2026-09-15"
    },
    {
      "id": "cn-minimax",
      "status": "native",
      "distribution": "official-download",
      "url": "https://chat.minimax.io/download",
      "verified": "2026-09-15"
    },
    {
      "id": "cn-qwen",
      "status": "native",
      "distribution": "google-play",
      "url": "https://play.google.com/store/apps/details?id=com.tongyi.intl",
      "verified": "2026-09-15"
    },
    {
      "id": "es-luzia",
      "status": "native",
      "distribution": "google-play",
      "url": "https://play.google.com/store/apps/details?id=co.thewordlab.luzia",
      "verified": "2026-09-15"
    },
    {
      "id": "fr-le-chat",
      "status": "native",
      "distribution": "google-play",
      "url": "https://play.google.com/store/apps/details?id=ai.mistral.chat",
      "verified": "2026-09-15",
      "note": "Android app now branded Vibe by Mistral."
    },
    {
      "id": "jp-felo",
      "status": "native",
      "distribution": "google-play",
      "url": "https://play.google.com/store/apps/details?id=ai.felo.search",
      "verified": "2026-09-15"
    },
    {
      "id": "ru-alice-yandex",
      "status": "native",
      "distribution": "google-play",
      "url": "https://play.google.com/store/apps/details?id=com.yandex.aliceapp",
      "verified": "2026-09-15"
    },
    {
      "id": "ru-gigachat",
      "status": "regional",
      "distribution": "rustore",
      "url": "https://www.rustore.ru/catalog/app/com.sdkit.search.app",
      "verified": "2026-09-15"
    },
    {
      "id": "ch-lumo",
      "status": "native",
      "distribution": "google-play",
      "url": "https://play.google.com/store/apps/details?id=me.proton.android.lumo",
      "verified": "2026-09-15"
    },
    {
      "id": "us-chatgpt",
      "status": "native",
      "distribution": "google-play",
      "url": "https://play.google.com/store/apps/details?id=com.openai.chatgpt",
      "verified": "2026-09-15"
    },
    {
      "id": "us-claude",
      "status": "native",
      "distribution": "google-play",
      "url": "https://play.google.com/store/apps/details?id=com.anthropic.claude",
      "verified": "2026-09-15"
    },
    {
      "id": "us-gemini",
      "status": "native",
      "distribution": "google-play",
      "url": "https://play.google.com/store/apps/details?id=com.google.android.apps.bard",
      "verified": "2026-09-15"
    },
    {
      "id": "us-grok",
      "status": "native",
      "distribution": "google-play",
      "url": "https://play.google.com/store/apps/details?id=ai.x.grok",
      "verified": "2026-09-15"
    },
    {
      "id": "us-meta-ai",
      "status": "native",
      "distribution": "google-play",
      "url": "https://play.google.com/store/apps/details?id=com.facebook.stella",
      "verified": "2026-09-15"
    },
    {
      "id": "us-notebooklm",
      "status": "native",
      "distribution": "google-play",
      "url": "https://play.google.com/store/apps/details?id=com.google.android.apps.labs.language.tailwind",
      "verified": "2026-09-15"
    },
    {
      "id": "us-perplexity",
      "status": "native",
      "distribution": "google-play",
      "url": "https://play.google.com/store/apps/details?id=ai.perplexity.app.android",
      "verified": "2026-09-15"
    },
    {
      "id": "us-pi",
      "status": "native",
      "distribution": "google-play",
      "url": "https://play.google.com/store/apps/details?id=ai.inflection.pi",
      "verified": "2026-09-15"
    },
    {
      "id": "us-venice",
      "status": "native",
      "distribution": "google-play",
      "url": "https://play.google.com/store/apps/details?id=com.ai.venice",
      "verified": "2026-09-15"
    },
    {
      "id": "us-you-com",
      "status": "native",
      "distribution": "google-play",
      "url": "https://play.google.com/store/apps/details?id=com.you.browser",
      "verified": "2026-09-15"
    },
    {
      "id": "de-textcortex",
      "status": "pwa",
      "distribution": "web-install",
      "url": "https://app.textcortex.com/c",
      "verified": "2026-09-15",
      "note": "Installable mobile web experience; not counted as a native Android app."
    },
    {
      "id": "us-textcortex",
      "status": "pwa",
      "distribution": "web-install",
      "url": "https://app.textcortex.com/user/dashboard/chat",
      "verified": "2026-09-15",
      "note": "Duplicate access point for the same TextCortex service."
    },
    {
      "id": "kr-wrtn",
      "status": "native",
      "distribution": "google-play",
      "url": "https://play.google.com/store/apps/details?id=com.wrtn.app",
      "verified": "2026-10-02"
    },
    {
      "id": "my-ilmuchat",
      "status": "native",
      "distribution": "google-play",
      "url": "https://play.google.com/store/apps/details?id=com.ytlailabs.ilmu.chat",
      "verified": "2026-10-02"
    },
    {
      "id": "sa-humain-chat",
      "status": "native",
      "distribution": "google-play",
      "url": "https://play.google.com/store/apps/details?id=ai.humain.chat",
      "verified": "2026-10-02"
    },
    {
      "id": "se-lovable",
      "status": "native",
      "distribution": "google-play",
      "url": "https://play.google.com/store/apps/details?id=dev.lovable.build",
      "verified": "2026-10-02"
    },
    {
      "id": "il-base44",
      "status": "native",
      "distribution": "google-play",
      "url": "https://play.google.com/store/apps/details?id=com.base44.android",
      "verified": "2026-10-02"
    },
    {
      "id": "uy-zapia",
      "status": "native",
      "distribution": "google-play",
      "url": "https://play.google.com/store/apps/details?id=com.brainlogic.zapia",
      "verified": "2026-10-02"
    },
    {
      "id": "gb-gb1",
      "status": "native",
      "distribution": "google-play",
      "url": "https://play.google.com/store/apps/details?id=com.locai.mobile",
      "verified": "2026-10-20",
      "note": "Official Google Play listing by Locai Labs Limited. Installation and availability for a Peruvian account were not tested."
    },
    {
      "id": "in-indus",
      "status": "native",
      "distribution": "google-play",
      "url": "https://play.google.com/store/apps/details?id=ai.sarvam.indus",
      "verified": "2026-10-20",
      "note": "Official Google Play listing by Sarvam AI. Installation, sign-in and Peruvian availability were not tested."
    },
    {
      "id": "cn-stepfun",
      "status": "native",
      "distribution": "google-play",
      "url": "https://play.google.com/store/apps/details?id=cn.yuewen.ywapp",
      "verified": "2026-10-20",
      "note": "Official Google Play listing by Shanghai StepFun company, linking yuewen.cn and stepfun.ai. Installation, supported phone countries and Peruvian availability were not tested."
    },
    {
      "id": "cn-longcat",
      "status": "native",
      "distribution": "official-download",
      "url": "https://github.com/meituan-longcat/LongCat-Flash-Omni#app",
      "verified": "2026-10-20",
      "note": "Publisher README explicitly offers Android through an official QR code. Link points to those instructions; QR target, APK signature, current package and installation were not independently tested. No Google Play listing is claimed."
    }
  ]
}
